Sprint,Duration_Days,Story_Points,Velocity,Sprint_Goal,Key_Features,Completion_Status
Sprint_1_Foundation_Core_Setup,5,21,21,Establish basic bookstore functionality with admin authentication,"Flask application setup, Database schema design, Admin user authentication, Basic book catalog display, Simple order creation",COMPLETED
Sprint_2_Security_Enhancement,3,18,18,Implement enterprise-level security with multi-factor authentication,"Two-factor authentication via email, Gmail SMTP integration, Session timeout management, Smart auto-logout on browser close, Password hashing improvements",COMPLETED
Sprint_3_Inventory_Management,4,25,25,Complete inventory management with CSV capabilities,"Full CRUD operations for books, Quantity-based deletion system, CSV import/export support, Bulk inventory operations, Genre classification system",COMPLETED
Sprint_4_Customer_System,6,28,28,Build complete customer registration and account management,"Customer registration with validation, Customer login/logout system, Customer account dashboard, Order history tracking, Guest checkout system",COMPLETED
Sprint_5_Advanced_Features,4,22,22,Payment validation notifications and UI enhancements,"Payment validation (Luhn algorithm), Comprehensive email notification system, Advanced shopping cart, Discount code system, Professional UI overhaul",COMPLETED
Sprint_6_Genre_Email_Enhancement,2,15,15,Comprehensive genre display and enhanced notifications,"Genre badges across templates, Genre form fields in admin, Guest checkout email confirmations, Admin order notifications, Enhanced purchase confirmation pages",COMPLETED
Sprint_7_Email_Low_Stock_Alerts,3,20,20,Automated admin notifications and inventory monitoring,"Customer order status update emails, Low stock inventory notification system, Admin dashboard improvements, Automated email triggers, Professional email templates",COMPLETED
Sprint_8_Professional_Cleanup,2,12,12,Repository cleanup and professional standards,"Complete emoji removal from 107+ files, Professional code standards, Comprehensive documentation updates, Git history optimization, Production-ready file organization",COMPLETED